{
  "schema_version": "1.0",
  "dataset": {
    "name": "uniprot",
    "version": "2024-01",
    "description": "UniProt database - January 2024 release"
  },
  "source": {
    "url": "ftp://ftp.uniprot.org/pub/databases/uniprot/current_release/knowledgebase/complete/uniprot_sprot.fasta.gz",
    "download_date": "2024-01-15T00:00:00Z",
    "server_mtime": "2024-01-10T00:00:00Z",
    "archive_hash": "blake3:1111111111111111111111111111111111111111111111111111111111111111"
  },
  "contents": [],
  "transformations": []
}
