{
  "schema_version": "1.0",
  "dataset": {
    "name": "test-db",
    "version": "1.1.0",
    "description": "Test database version 1.1.0 - bugfix release"
  },
  "source": {
    "url": "https://example.com/test-db/v1.1.0.tar.gz",
    "download_date": "2024-02-01T00:00:00Z",
    "server_mtime": "2024-02-01T00:00:00Z",
    "archive_hash": "blake3:0000000000000000000000000000000000000000000000000000000000000002"
  },
  "contents": [],
  "transformations": []
}
