{
  "schema_version": "1.0",
  "dataset": {
    "name": "uniprot",
    "version": "2024-01",
    "description": "UniProt Swiss-Prot Protein Knowledgebase"
  },
  "source": {
    "url": "https://ftp.uniprot.org/pub/databases/uniprot/current_release/knowledgebase/complete/uniprot_sprot.fasta.gz",
    "download_date": "2024-01-20T09:00:00Z",
    "server_mtime": "2024-01-19T15:30:00Z",
    "archive_hash": "blake3:d5ef789012cdef01234567890abcdef1234567890abcdef1234567890abcdef"
  },
  "contents": [
    {
      "path": "uniprot_sprot.fasta",
      "hash": "blake3:e6f0890123def012345678901bcdef01234567890abcdef1234567890abcdef",
      "size": 87654321,
      "executable": false
    }
  ],
  "transformations": []
}
